{
  "stimulus_id": "SM_024",
  "task_type": "SemanticMatching",
  "correct_response": "right",
  "left_right_balance": "right",
  "is_excluded": false,
  "payload": {
    "center_image": "semantic_matching/Image70.jpg",
    "left_image": "semantic_matching/Image72.jpg",
    "right_image": "semantic_matching/Image71.jpg",
    "center_label": "",
    "left_label": "",
    "right_label": "",
    "semantic_category": "nature"
  }
}