{
  "stimulus_id": "SM_009",
  "task_type": "SemanticMatching",
  "correct_response": "left",
  "left_right_balance": "left",
  "is_excluded": false,
  "payload": {
    "center_image": "semantic_matching/Image25.jpg",
    "left_image": "semantic_matching/Image26.jpg",
    "right_image": "semantic_matching/Image27.jpg",
    "center_label": "",
    "left_label": "",
    "right_label": "",
    "semantic_category": "vehicles"
  }
}