{
  "stimulus_id": "SM_004",
  "task_type": "SemanticMatching",
  "correct_response": "right",
  "left_right_balance": "right",
  "is_excluded": false,
  "payload": {
    "center_image": "semantic_matching/Image10.png",
    "left_image": "semantic_matching/Image12.jpg",
    "right_image": "semantic_matching/Image11.jpg",
    "center_label": "",
    "left_label": "",
    "right_label": "",
    "semantic_category": "animals"
  }
}